{
   "name": "TestProject",
   "description": "Test",
   "version": "1.0",
   "targets": {
      "test_target": {
         "tasks": [
            {
               "type": "create_directory",
               "params": {
                  "dir": "test_dir"
               }
            }
         ]
      }
   },
   "default_target": "test_target"
}
